<?xml version="1.0" encoding="UTF-8"?>
<?xml-stylesheet type="text/xsl" href="http://bmatsuo.github.io/Resume/xml-resume/xsl/html.xsl"?>
<resume xmlns="http://bmatsuo.github.io/xml-resume/0.3"
        xmlns:xsi="http://www.w3.org/2001/XMLSchema-instance"
        xsi:schemaLocation="http://bmatsuo.github.io/xml-resume/0.3 http://bmatsuo.github.io/xml-resume/0.3/schema/resume.xsd">
    <header>
        <name>Bryan Matsuo</name>
        <contact>
            <email>bryan.matsuo@gmail.com</email>
            <link href="https://github.com/bmatsuo">GitHub</link>
        </contact>
    </header>
    <skills category="Programming languages">
        <skill>Go</skill>
        <skill>Python</skill>
        <skill>Shell (bash)</skill>
        <skill>C/C++</skill>
        <skill>Ruby</skill>
        <skill>Lisp</skill>
        <skill>Lua</skill>
        <skill>Scala</skill>
        <skill>Haskell</skill>
    </skills>
    <skills category="Software and technology">
        <skill>Linux</skill>
        <skill>AWS</skill>
        <skill>Kubernetes/Helm</skill>
        <skill>Terraform</skill>
        <skill>Ansible</skill>
        <skill>Prometheus/Statsd/Graphite/Grafana</skill>
        <skill>gRPC/Protobuf</skill>
    </skills>
    <!--interests>
        <interest>Pragmatism</interest>
        <interest>Systems programming</interest>
        <interest>Infrastructure as code</interest>
    </interests-->
    <history>
        <employment>
            <position>Senior Software Engineer</position>
            <employer>Kunai</employer>
            <dates from="Jun 2025" to="Current"/>
            <description>
                <para>
                    Collaborating across teams in a large enterprise to update
                    and integrate software systems following a corporate
                    merger.  Writing documentation and comprehensive tests for
                    features and coordinating deployments to minimize adverse
                    impacts.
                </para>
            </description>
        </employment>
        <employment>
            <position>Go Software Engineer (Contract)</position>
            <employer>The Select Group (Comcast)</employer>
            <dates from="Aug 2023" to="Nov 2024"/>
            <description>
                <para>
                    Design and maintenance for a variety of serverless data
                    applications in Go leveraging AWS Lambda, Kinesis, Kafka,
                    NATS JetStream, DynamoDB, and Postgres.  Managing cloud
                    infrastructure with Terraform and Ansible. Developing
                    Grafana dashboards for real time monitoring of application
                    and infrastructure performance metrics.
                </para>
            </description>
        </employment>
        <employment>
            <position>Senior Software Engineer</position>
            <employer>Luther Systems, Ltd</employer>
            <dates from="Nov 2016" to="Jul 2023"/>
            <description>
                <para>
                    Development of an enterprise blockchain application
                    platform. Development and maintenance of Go microservices
                    and AWS Lambda functions connecting users and third-parties
                    with blockchains. Leading development of embedded Lisp
                    interpreter and Go SDK to streamline customer experiences.
                    Configuration and maintenance of system infrastructure in
                    AWS with Terraform and Ansible. Extensive Python and Bash
                    scripting for deploying and managing application
                    operations. Transitioning complex distributed systems from
                    AWS EC2 to Kubernetes using Helm. Implementation of
                    platform monitoring and alerting with Prometheus,
                    PagerDuty, and Grafana.
                </para>
            </description>
        </employment>
        <employment>
            <position>Senior Software Engineer</position>
            <employer>Janrain, Inc</employer>
            <dates from="Apr 2014" to="Nov 2015"/>
            <description>
                <para>
                    Primary development of backend data processing systems
                    using Go and Python along with related maintenance on
                    existing, related systems.  Development of service
                    packaging, deployment, and monitoring methodologies and
                    tooling to support them.
                </para>
            </description>
        </employment>
        <employment>
            <position>Software Engineer</position>
            <employer>Janrain, Inc</employer>
            <dates from="Feb 2012" to="Apr 2014"/>
            <description>
                <para>
                    Development of OpenID and OAuth integrations and backend
                    components for a user management offering.  Participant in
                    product design discussions. Responsible for meeting
                    deadlines with rapid customer rollout.  Responsible for
                    training the internal user base and facilitating adoption
                    of a new product.
                </para>
            </description>
        </employment>
        <academic>
            <institution>Univ of Califonia - Santa Cruz</institution>
            <dates from="Sept 2004" to="Mar 2009"/>
            <concentration type="major">
                <subject>Computer Science</subject>
                <degree>B.S.</degree>
            </concentration>
            <concentration type="major">
                <subject>Mathematics</subject>
                <degree>B.A.</degree>
            </concentration>
            <achievement>
                <title>Honors in Computer Science</title>
            </achievement>
            <achievement>
                <title>Highest honors in Mathematics</title>
            </achievement>
        </academic>
    </history>
</resume>
